Video id,Link,Primary Tag,Secondary Tag,Rating,Coder_Description,desc
lhSlJkAobkE,youtube.com/watch?v=lhSlJkAobkE,child directed,Health and Hygiene for Kids,,colgate ad,This is an ad for colgate toothpaste. The ad starts with a shot of the toothpaste on a sink with fluctuating lights. Then a walks in and starts to brush his teeth. The video ends with a closeup of the box of the toothpaste. The narrator is talking about the importance of the toothpaste and there is text on the screen advertising cavity protecting properties of the product. This video in not inappropriate.
vAwkamysdq4,youtube.com/watch?v=vAwkamysdq4,child directed,Kids Cooking & Food,,"Tang ad, juice/drink targetting kids","This is an for a juice called tang. The video shows a child playing with a sock puppet and a clock starts making noise. The girl predicts that it is time to do maths and the mother yells the same thing a few seconds later. Then the camera cuts and in the next scene the girl again predicts that it is time for english but the mother instead says ""tang time"" which causes the girl to get confused. The next clip shows the juice being mixed and the girl drinking the juice while the mother talks about the benifits of the juice such as it contains vitamins. This video is not inappropriate."
MW7kQ8w5c24,youtube.com/watch?v=MW7kQ8w5c24,irrelevant,Gaming & Entertainment,,tv show channel ad,"This is an ad on a Pakistani TV channel. It talks about feminism and role of women in the society while showing multiple women in different jobs/roles like the army, office or home. The background has music sung by a woman aiming to enhance the message the ad is trying to send. This ad is not inappropriate as it does not have any content that is harmful to kids."
asxeoJNgr8s,youtube.com/watch?v=asxeoJNgr8s,irrelevant,Autos & Vehicles,,Volvo electric car,This is an advert of a car called the Volvo XC40. The ad is short and only shows salient features about the car like its electric drivetrain and ample interior space by showing people using these features. The ad has lively music and narration and seems to target a younger audience. This ad is not inappropriate.
Al_hHfSJf6s,youtube.com/watch?v=Al_hHfSJf6s,irrelevant,Music & Performance,,Orchestra playing violins,This is a video featuring an orchestra performance. There are multiple people in the orchestra playing different insturments such as violins and trumpets and a conductor. The video also pans to the audience that seems to be enjoying the performance. There is no inappropriate content in this video.
C4eImvXoQ78,youtube.com/watch?v=C4eImvXoQ78,irrelevant,Sports & Athletics,,Ad for skateboard,This is an ad for a skateboard shop and features a woman showcasing skateboards and explaining the offer in which customers would get a free shirt with every skateboard purchased. She first holds a skateboard and then changes into a shirt for the shop. She also talks about the offer in the audio and the background has lively music. The skateboards have colourful designs and the intent of the ad is to convince people to avail the offer. This ad is not inappropriate.
73bCxYRXYjw,youtube.com/watch?v=73bCxYRXYjw,irrelevant,Sports & Athletics,,sports equipment ad,This is an ad for a tire company called Laufenn that has partenered with Major League Baseball. The ad is animated and shows the pitcher attempting to hit the ball which later turns into a tire showcasing the partnership. There is music in the background and in the end the narrator speaks out the name of the company. This ad is not inappropriate. 
WilnmR4lX6k,youtube.com/watch?v=WilnmR4lX6k,irrelevant,Travel & Adventure,,Travel vlog of a person visiting a resort in miami,"This is a travel vlog from a series by Jeremías Martorell. THe series is called ""While other sleeps"" and in this episode the main character reports his travel. The video starts in Miami Florida and features his journey to Tulum in Mexico. The vlogger shows all aspects of his travels from getting his stuff ready to sitting in his car and leaving for Mexico in a plane and then to Tulum. The video also features his experience with local cuisine. This video is not inappropriate."
jrzx2OtBHI4,youtube.com/watch?v=jrzx2OtBHI4,irrelevant,Food and Cooking,,recipe for black beans sauce,This is a recipe for a black bean sauce narrated by a woman. The recipe starts by showing off the ingredients required in the recipe and then step-by-step shows the dish coming together. Different stages of the process that is preperation and cooking are also marked in the video. This video is not inappropriate.
JpNCpykjPqk,youtube.com/watch?v=JpNCpykjPqk,irrelevant,Software,,"Help protect your site with a SSL certificate, goDaddy",This is a short advertisement for the use of Secure Sockets Layer in websites by Go Daddy. The narrator of the video describes that SSL is useful for securing website and that it is needed for protecting customers data. The video itself has short clips from local businesses and also shows how that the lock logo in address bars means that the website is safe. This video is not inappropriate.
Q3IZ_njcyMc,youtube.com/watch?v=Q3IZ_njcyMc,irrelevant,Autos & Vehicles,,Ad showing features of Kia EV6,"This is an ad for the Kia EV6, an electric SUV.  The song features the car driving around a city, a guy surfing in a river using a hydrofoil and a person singing a song. The ad shows multiple angles of the cars. The music in the background is upbeat and the people in the video seem to show that the car is for an active lifestyle. This ad is not inappropriate"
S1t90ucM-54,youtube.com/watch?v=S1t90ucM-54,irrelevant,Education & Learning,,a tedx talk based on the advantages of making notes by hand,"This is a Ted talk given by Katie McCleary who talks about the advantages of making notes by hand while studying. The video shows Katie on a stage talking in front of an audience, telling people about her past experience and how writing by hand increases productivity and makes learning more effective. This video is not inappropriate."
DBZzLD06Ogg,youtube.com/watch?v=DBZzLD06Ogg,irrelevant,Home and Office,,ad for dish washing liquid,This is an ad for Maxis dishwashing liquiq. The ad first shows a bottle of the liquid zooming in on the label that says it contains bicarbonate. The video then shows a dish sponge cleaning a dirty dish with the soap and it gets immediately cleaned. This video is not inappropriate.
ujPC9wQNbtc,youtube.com/watch?v=ujPC9wQNbtc,irrelevant,Software,,A tutorial for how to use shopify,"This is a tutorial on how to use the e-commerce website called shopify. The video contains a presentation that desciribe what shopify is, how to use it and how much it costs. The narrator reads out the slides and also provides more details about the website. In the end the narrator also shows Shopify's website and the different plans available there. This video is not inappropriate. "
gJY0MyGDru8,youtube.com/watch?v=gJY0MyGDru8,inappropriate,Offensive language,Extreme,Ad of a music video. Song has explicit lyrics,"This is a music video and starts off with a dark sped-up clip of a man walking in a forest. Then we see a silhouette of the man. It is filled with  bright blue and purple. Then the man appears on the screen again and starts to sing. There are some references to drugs in the lyrics and the man goes on to sing ""I don't even fucking matter to her"". Due to the use of profane language, the video is inappropriate for children."
m0ROtuAfOLg,youtube.com/watch?v=m0ROtuAfOLg,inappropriate,Physical Violence,Extreme,"haryanvi mv - shows a gun, physical violence; sensual, harassment!!","This is a music video that starts with a man walking towards the audience. There are two cars behind him and one of the cars has two shotguns placed on it. The man then holds up a gun and rests on his shoulders. The next clip shows the same man driving in a jeep and then the camera shows some people sitting together. The next clip shows a different man singing. In a subsequent clip, a man serves food to a group of people sitting. He accidentally drops the food, and one of the men grabs him by the collar and hits him. In another clip, a man caresses and kisses a woman's hand. In another clip, a woman is sitting at a table with another woman and a man shows up and grabs her clothes and harasses her by grabbing her hand. Due to the presence of guns, physical violence and harassment, this video is inappropriate for children. The video also contains some elements of sensual touch which also makes it inappropriate for children."
xis-u5vGsFs,youtube.com/watch?v=xis-u5vGsFs,irrelevant,Autos & Vehicles,,Ad showing features of Kia Sportage,"This is an advertisement for a car, Kia Sportage. Scenes feature clips of the car's exterior and interior as a woman drives the car and smiles. This video is not inappropriate."